{
  "$schema": "http://json-schema.org/draft-07/schema#",
  "title": "Open CoT RFC 0003 - Execution Intent and Endpoint Invocation",
  "type": "object",
  "additionalProperties": false,
  "properties": {
    "intent_id": {
      "type": "string",
      "minLength": 1
    },
    "snapshot_id": {
      "type": "string",
      "minLength": 1
    },
    "endpoint_id": {
      "type": "string",
      "minLength": 1
    },
    "capability_name": {
      "type": "string",
      "minLength": 1
    },
    "capability_digest": {
      "type": "string",
      "pattern": "^[a-f0-9]{64}$"
    },
    "risk_level": {
      "type": "string",
      "enum": [
        "read",
        "write",
        "destructive",
        "external_side_effect"
      ]
    },
    "requires_approval": {
      "type": "boolean"
    },
    "idempotency_key": {
      "type": "string",
      "minLength": 1
    },
    "arguments": {
      "type": "object"
    },
    "preconditions": {
      "type": "array",
      "items": {
        "type": "string"
      }
    },
    "expected_result_shape": {
      "type": "object",
      "additionalProperties": true
    },
    "postconditions": {
      "type": "array",
      "items": {
        "type": "string"
      }
    }
  },
  "required": [
    "intent_id",
    "snapshot_id",
    "endpoint_id",
    "capability_name",
    "capability_digest",
    "risk_level",
    "requires_approval",
    "idempotency_key",
    "arguments"
  ],
  "$id": "https://opencot.dev/schemas/rfc-0003-execution-intent.json",
  "x-opencot": {
    "rfc": "0003",
    "shortname": "execution_intent",
    "source_rfc": "rfcs/0003-execution-intent.md"
  }
}
